{
  "$schema": "./ranking.schema.json",
  "version": "2026-09-26.1",
  "weights": {
    "editorialPick": 0.15,
    "partnerTier": 0.1,
    "qualityTier": 0.32,
    "freshness": 0.12,
    "installs": 0.06,
    "recentInstalls": 0.13,
    "momentum": 0.06,
    "stars": 0.06
  },
  "qualityTierValues": {
    "strict-compliant": 1.0,
    "no-errors": 0.8,
    "ready-to-install": 0.5,
    "needs-help": 0.15
  },
  "partnerTierValues": {
    "platinum": 1.0,
    "gold": 0.8,
    "silver": 0.6,
    "bronze": 0.4
  },
  "freshnessHalfLifeDays": 180,
  "popularityPercentile": 0.95,
  "momentumCeiling": 4,
  "penalties": {
    "deranked": 0.3,
    "abandoned": 0.1
  }
}
